{"run":29,"commit":"5b270da","metric":6.301,"metrics":{"best_ms":5.784,"worst_ms":9.888,"session_count":480,"entries_per_session":19,"large_session_count":80,"total_session_bytes":13334064},"status":"discard","description":"Reduce the bounded metadata head read from 2KB to 1KB","timestamp":1776801475010,"segment":1,"confidence":5.627998427054662,"iterationTokens":1034,"asi":{"hypothesis":"A 1KB metadata head might be enough for generated headers and short first user prompts, further reducing I/O.","rollback_reason":"Median regressed versus 5.936ms; 1KB is too small or too noisy for this corpus and risks more full-file fallbacks on real longer prompts.","next_action_hint":"Keep 2KB as the best observed balance between short reads and fallback avoidance."}}
{"run":30,"commit":"5b270da","metric":6.094,"metrics":{"best_ms":5.56,"worst_ms":8.548,"session_count":480,"entries_per_session":19,"large_session_count":80,"total_session_bytes":13334064},"status":"discard","description":"Try a 1536-byte bounded metadata head read","timestamp":1776801508792,"segment":1,"confidence":9.749318801089919,"iterationTokens":946,"asi":{"hypothesis":"A 1536-byte head could split the difference between the fast but risky 1KB read and the best 2KB read.","rollback_reason":"Median regressed versus 5.936ms; 2KB remains the best observed head size and is safer for real prompts.","next_action_hint":"Stop tuning head size unless the benchmark corpus changes; 2KB has the best balance so far."}}
{"run":31,"commit":"5b270da","metric":7.097,"metrics":{"best_ms":5.639,"worst_ms":8.589,"session_count":480,"entries_per_session":19,"large_session_count":80,"total_session_bytes":13334064},"status":"discard","description":"Reuse one metadata head buffer across stored session reads","timestamp":1776801550542,"segment":1,"confidence":8.239493379389756,"iterationTokens":1317,"asi":{"hypothesis":"Avoiding Buffer.allocUnsafe for every session file might reduce allocation overhead during the startup scan.","rollback_reason":"Median regressed versus 5.936ms; a fresh small buffer per read is faster or less deoptimizing than passing a shared optional buffer through this path.","next_action_hint":"Keep per-call head buffer allocation unless a profiler shows allocation pressure under larger session counts."}}
{"run":32,"commit":"5b270da","metric":6.417,"metrics":{"best_ms":5.863,"worst_ms":9.259,"session_count":480,"entries_per_session":19,"large_session_count":80,"total_session_bytes":13334064},"status":"checks_failed","description":"Return metadata directly from the head parser instead of wrapping a foundFirstUser flag","timestamp":1776801591496,"segment":1,"confidence":12.42361111111112,"iterationTokens":1826,"asi":{"hypothesis":"Avoid one wrapper object allocation per parsed session by making the parser return metadata directly and require a first-user result for incomplete head buffers.","rollback_reason":"Type check failed because the fallback return still referenced the removed .metadata wrapper property.","next_action_hint":"Retry with the fallback updated to return parseStoredSessionMetadataContent(... ) directly, then evaluate performance."}}
{"run":33,"commit":"5b270da","metric":6.06,"metrics":{"best_ms":5.662,"worst_ms":8.67,"session_count":480,"entries_per_session":19,"large_session_count":80,"total_session_bytes":13334064},"status":"discard","description":"Return metadata directly from the head parser without wrapper allocation","timestamp":1776801629348,"segment":1,"confidence":13.801350048215998,"iterationTokens":1413,"asi":{"hypothesis":"Avoiding the parser wrapper object and foundFirstUser property could reduce allocation while preserving fallback semantics with a requireFirstUser parameter.","rollback_reason":"Median regressed versus 5.936ms; the extra parameter branch outweighed removing the wrapper allocation.","next_action_hint":"Keep the wrapper return shape; V8 likely optimizes it well enough."}}
{"run":34,"commit":"5b270da","metric":6.137,"metrics":{"best_ms":5.61,"worst_ms":8.749,"session_count":480,"entries_per_session":19,"large_session_count":80,"total_session_bytes":13334064},"status":"discard","description":"Skip live-session directory scan when the live file is already in the stored set","timestamp":1776801675284,"segment":1,"confidence":20.044817927170858,"iterationTokens":1361,"asi":{"hypothesis":"After building the stored session file Set, a direct has(liveSessionFile) check can avoid re-reading the live workspace directory without expensive path containment checks.","rollback_reason":"Median regressed versus 5.936ms; the extra branch did not beat the simple duplicate-add path for this corpus.","next_action_hint":"Keep the unconditional live directory merge unless duplicate live-dir scans become much more expensive."}}
{"run":35,"commit":"5b270da","metric":7.765,"metrics":{"best_ms":5.599,"worst_ms":8.59,"session_count":480,"entries_per_session":19,"large_session_count":80,"total_session_bytes":13334064},"status":"discard","description":"Use a literal 2048-byte metadata head constant","timestamp":1776801725266,"segment":1,"confidence":13.801350048215998,"iterationTokens":1745,"asi":{"hypothesis":"Replacing 2 * 1024 with a literal 2048 might avoid repeated constant expression work or improve readability without behavior change.","rollback_reason":"Median regressed due to noise or no real effect; no behavioral improvement over the existing 2KB expression.","next_action_hint":"Do not keep no-op constant spelling changes as performance work."}}
{"run":36,"commit":"5b270da","metric":7.257,"metrics":{"best_ms":5.813,"worst_ms":8.714,"session_count":480,"entries_per_session":19,"large_session_count":80,"total_session_bytes":13334064},"status":"discard","description":"Remove the sessions-root existsSync check before readdir","timestamp":1776801765947,"segment":1,"confidence":12.19080068143101,"iterationTokens":1292,"asi":{"hypothesis":"Avoiding a redundant existsSync stat before readdir could reduce session root enumeration overhead in the common existing-root case.","rollback_reason":"Median regressed versus 5.936ms; exception-safe readdir setup did not improve the hot path.","next_action_hint":"Keep the explicit existsSync guard for now."}}
{"run":37,"commit":"5b270da","metric":11.328,"metrics":{"best_ms":9.294,"worst_ms":26.972,"session_count":480,"entries_per_session":19,"large_session_count":80,"total_session_bytes":13334064},"status":"discard","description":"Read stored session metadata heads concurrently with fs.promises","timestamp":1776801866273,"segment":1,"confidence":8.87290762554247,"iterationTokens":4475,"asi":{"hypothesis":"Parallel async 2KB head reads might reduce wall time for many stored session files on disk-backed startup loads.","rollback_reason":"Median regressed sharply versus 5.936ms and worst-case latency spiked; Promise and file-handle overhead dominated this workload.","next_action_hint":"Keep synchronous sequential head reads. If real cold disk traces show I/O wait dominates, consider a bounded async worker pool rather than Promise.all over every file."}}
{"run":38,"commit":"5b270da","metric":6.792,"metrics":{"best_ms":5.803,"worst_ms":10.195,"session_count":480,"entries_per_session":19,"large_session_count":80,"total_session_bytes":13334064},"status":"discard","description":"Avoid slicing the decoded metadata head before parsing complete JSONL lines","timestamp":1776801966934,"segment":1,"confidence":10.252148997134679,"iterationTokens":4885,"asi":{"hypothesis":"Passing an end offset into the parser could avoid allocating head.slice(0,lastNewline) for every long session file.","rollback_reason":"Median regressed versus 5.936ms; the extra parser end-bound checks outweighed the saved slice allocation.","next_action_hint":"Keep the simpler slice-based parser for V8-friendly loops."}}
{"run":39,"commit":"5b270da","metric":6.658,"metrics":{"best_ms":6.367,"worst_ms":9.897,"session_count":480,"entries_per_session":19,"large_session_count":80,"total_session_bytes":13334064},"status":"discard","description":"Use an array plus pre-read duplicate checks for stored session paths under head reads","timestamp":1776802013107,"segment":1,"confidence":11.626320064987818,"iterationTokens":1243,"asi":{"hypothesis":"With bounded 2KB metadata reads, avoiding Set construction for file paths might become worthwhile if duplicates are skipped before reading metadata.","rollback_reason":"Median regressed versus 5.936ms; Set-based path de-duplication remains faster even after head reads made duplicate metadata reads cheaper.","next_action_hint":"Do not revisit array path collection unless file enumeration is redesigned."}}
{"run":40,"commit":"5b270da","metric":8.62,"metrics":{"best_ms":6.375,"worst_ms":10.142,"session_count":480,"entries_per_session":19,"large_session_count":80,"total_session_bytes":13334064},"status":"discard","description":"Stat session files and fully read files that fit inside the metadata head size","timestamp":1776802067031,"segment":1,"confidence":10.252148997134679,"iterationTokens":1809,"asi":{"hypothesis":"A stat-based small-file fast path could preserve full-read performance for tiny sessions while using bounded heads for larger transcripts.","rollback_reason":"Median regressed versus 5.936ms; adding a stat per file was much more expensive than just attempting the 2KB head read.","next_action_hint":"Do not add per-file stat in list_sessions hot path."}}
{"run":41,"commit":"e774475","metric":5.852,"metrics":{"best_ms":5.268,"worst_ms":9.405,"session_count":480,"entries_per_session":19,"large_session_count":80,"total_session_bytes":13334064},"status":"keep","description":"Fast-path generated user message string content while scanning session metadata heads","timestamp":1776802133965,"segment":1,"confidence":11.07033639143731,"iterationTokens":2404,"asi":{"hypothesis":"Most session display names come from generated JSONL user message entries with string content, so extracting that string directly can avoid full JSON.parse of the message object on the hot path while falling back for other shapes.","implementation_note":"Added extractGeneratedUserContent for JSON.stringify-style user content strings; it decodes the JSON string slice and existing full JSON.parse path remains for session_info, arrays, or unusual lines.","observed_result":"Mixed workload median improved from 5.936ms to 5.852ms with checks passing; small but primary metric improved."}}
{"run":42,"commit":"e774475","metric":6.813,"metrics":{"best_ms":5.656,"worst_ms":9.711,"session_count":480,"entries_per_session":19,"large_session_count":80,"total_session_bytes":13334064},"status":"discard","description":"Use a simple closing-quote indexOf in the generated user content fast path","timestamp":1776802176253,"segment":1,"confidence":10.372492836676225,"iterationTokens":1705,"asi":{"hypothesis":"Most first user strings do not contain escaped quotes, so using the first closing quote and falling back on parse failure might beat scanning for escaped quotes.","rollback_reason":"Median regressed versus 5.852ms; the simpler indexOf shape was slower or caused less favorable parsing behavior despite the common corpus.","next_action_hint":"Keep the explicit escaped-quote scan in extractGeneratedUserContent."}}
{"run":43,"commit":"e774475","metric":5.859,"metrics":{"best_ms":5.378,"worst_ms":9.64,"session_count":480,"entries_per_session":19,"large_session_count":80,"total_session_bytes":13334064},"status":"discard","description":"Avoid JSON.parse for generated user strings that contain no escapes","timestamp":1776802221374,"segment":1,"confidence":11.07033639143731,"iterationTokens":1302,"asi":{"hypothesis":"Most generated first user content strings have no JSON escapes, so returning the raw slice could avoid JSON.parse on the hot path.","rollback_reason":"Median was slightly worse than 5.852ms; the escape tracking branch outweighed string JSON.parse savings in this workload.","next_action_hint":"Keep the simpler JSON.parse string-slice decoder."}}
{"run":44,"commit":"e774475","metric":6.101,"metrics":{"best_ms":5.633,"worst_ms":10.709,"session_count":480,"entries_per_session":19,"large_session_count":80,"total_session_bytes":13334064},"status":"discard","description":"Fast-path generated session header string fields during metadata parsing","timestamp":1776802292048,"segment":1,"confidence":12.333901192504264,"iterationTokens":2553,"asi":{"hypothesis":"Generated session headers have stable JSON string fields, so extracting id/timestamp/cwd directly might avoid a full JSON.parse per file.","rollback_reason":"Median regressed versus 5.852ms; multiple string scans and JSON string parses cost more than parsing the small header object.","next_action_hint":"Keep JSON.parse for session headers; the user-message fast path is the only string extraction worth keeping so far."}}
{"run":45,"commit":"5c6ed6c","metric":5.509,"metrics":{"best_ms":5.328,"worst_ms":8.143,"session_count":480,"entries_per_session":19,"large_session_count":80,"total_session_bytes":13334064},"status":"keep","description":"Retune the metadata head read to 1KB after adding generated user-content extraction","timestamp":1776802328059,"segment":1,"confidence":12.670008354218881,"iterationTokens":1046,"asi":{"hypothesis":"After the generated user-content fast path reduced parsing cost, a smaller 1KB head may be enough and reduce per-file I/O more than it increases fallbacks.","implementation_note":"STORED_SESSION_METADATA_HEAD_BYTES changed from 2KB to 1KB with full-file fallback unchanged.","observed_result":"Mixed workload median improved from 5.852ms to 5.509ms; earlier 1KB regressed before the user-content fast path, so the combination matters."}}
{"run":46,"commit":"d8d608c","metric":5.285,"metrics":{"best_ms":5.114,"worst_ms":8.277,"session_count":480,"entries_per_session":19,"large_session_count":80,"total_session_bytes":13334064},"status":"keep","description":"Reduce the metadata head read from 1KB to 512 bytes after fast user extraction","timestamp":1776802368116,"segment":1,"confidence":13.033388981636076,"iterationTokens":975,"asi":{"hypothesis":"With direct generated user-content extraction, a 512-byte head may still contain the generated header and first user line while further reducing I/O.","implementation_note":"STORED_SESSION_METADATA_HEAD_BYTES changed from 1KB to 512 bytes; fallback still handles longer initial prompts or delayed first user entries.","observed_result":"Mixed workload median improved from 5.509ms to 5.285ms."}}
{"run":47,"commit":"d8d608c","metric":15.486,"metrics":{"best_ms":14.441,"worst_ms":19.134,"session_count":480,"entries_per_session":19,"large_session_count":80,"total_session_bytes":13334064},"status":"discard","description":"Reduce the metadata head read from 512 bytes to 256 bytes","timestamp":1776802401412,"segment":1,"confidence":11.722222222222225,"iterationTokens":932,"asi":{"hypothesis":"A 256-byte head might further reduce I/O if the header and first user line are very short.","rollback_reason":"Median regressed catastrophically because many generated first user lines no longer fit, causing full-file fallback reads for long sessions.","next_action_hint":"Keep 512 bytes as the minimum safe head size for this corpus; do not reduce further."}}
{"run":48,"commit":"d8d608c","metric":5.827,"metrics":{"best_ms":5.465,"worst_ms":9.719,"session_count":480,"entries_per_session":19,"large_session_count":80,"total_session_bytes":13334064},"status":"discard","description":"Try a 768-byte metadata head read","timestamp":1776802438190,"segment":1,"confidence":10.813019390581712,"iterationTokens":891,"asi":{"hypothesis":"A 768-byte head might be safer than 512 bytes while still much smaller than 1KB.","rollback_reason":"Median regressed versus 5.285ms; 512 bytes is better on the mixed corpus and 256 bytes showed the fallback cliff.","next_action_hint":"Keep 512-byte metadata heads unless changing the corpus to include longer initial prompts."}}
{"type":"config","name":"Optimize web bridge initial session list load with long transcripts and long initial prompts","metricName":"session_list_ms","metricUnit":"ms","bestDirection":"lower"}
{"run":49,"commit":"dac2f9a","metric":8.956,"metrics":{"best_ms":8.022,"worst_ms":11.498,"session_count":480,"entries_per_session":19,"large_session_count":80,"long_initial_prompt_count":48,"total_session_bytes":13441680},"status":"keep","description":"Baseline robust mixed corpus with long transcripts and long initial prompts","timestamp":1776802528056,"segment":2,"confidence":null,"iterationTokens":108,"asi":{"hypothesis":"Broaden the workload again to avoid overfitting the 512-byte metadata head to short first user messages.","benchmark_shape":"8 workspaces x 60 sessions, 80 long transcript sessions, 48 long initial prompts, 13.4MB total JSONL, median of 7 fresh adapter RPCs.","baseline_note":"Current 512-byte head often falls back on long initial prompts, raising median to 8.956ms."}}
{"run":50,"commit":"dac2f9a","metric":9.61,"metrics":{"best_ms":8.756,"worst_ms":13.144,"session_count":480,"entries_per_session":19,"large_session_count":80,"long_initial_prompt_count":48,"total_session_bytes":13441680},"status":"discard","description":"Raise the metadata head read from 512 bytes to 2KB for long initial prompts","timestamp":1776802563599,"segment":2,"confidence":null,"iterationTokens":933,"asi":{"hypothesis":"Long initial prompts may need a larger metadata head to avoid full-file fallback, so 2KB could be more robust than 512 bytes.","rollback_reason":"Median regressed versus the 512-byte baseline; larger reads cost more than the fallback savings for this robust mixed corpus.","next_action_hint":"Try intermediate sizes or smarter retry reads rather than raising every session to 2KB."}}
{"run":51,"commit":"fd0a6ff","metric":7.412,"metrics":{"best_ms":6.882,"worst_ms":10.958,"session_count":480,"entries_per_session":19,"large_session_count":80,"long_initial_prompt_count":48,"total_session_bytes":13441680},"status":"keep","description":"Retry with a 4KB metadata head before full-file fallback for long initial prompts","timestamp":1776802659887,"segment":2,"confidence":2.3608562691131496,"iterationTokens":4610,"asi":{"hypothesis":"Keep the fast 512-byte read for most sessions, but retry with a 4KB head before full-file fallback so long initial prompts avoid loading the entire transcript.","implementation_note":"Added readStoredSessionMetadataHead and a 4KB retry path; only sessions that do not produce first-user metadata in the 512-byte head pay the second head read.","observed_result":"Robust mixed workload median improved from 8.956ms to 7.412ms with checks passing."}}
{"run":52,"commit":"fd0a6ff","metric":8.877,"metrics":{"best_ms":7.846,"worst_ms":12.394,"session_count":480,"entries_per_session":19,"large_session_count":80,"long_initial_prompt_count":48,"total_session_bytes":13441680},"status":"discard","description":"Use a 2KB retry metadata head before full-file fallback","timestamp":1776802785341,"segment":2,"confidence":4.212824010914048,"iterationTokens":7086,"asi":{"hypothesis":"A 2KB retry after the fast 512-byte head may cover many long initial prompts with less read/decode cost than the current 4KB retry.","rollback_reason":"Median regressed versus 7.412ms; 2KB retry is not enough for enough long prompts and causes more full-file fallback.","next_action_hint":"Keep 4KB retry as the best current robust-corpus balance."}}
{"run":53,"commit":"fd0a6ff","metric":7.43,"metrics":{"best_ms":6.761,"worst_ms":9.886,"session_count":480,"entries_per_session":19,"large_session_count":80,"long_initial_prompt_count":48,"total_session_bytes":13441680},"status":"discard","description":"Use an 8KB retry metadata head before full-file fallback","timestamp":1776802822805,"segment":2,"confidence":2.106412005457029,"iterationTokens":950,"asi":{"hypothesis":"An 8KB retry may avoid full-file fallback for more long initial prompts than 4KB, potentially improving robust startup despite extra retry read cost.","rollback_reason":"Median was slightly worse than 7.412ms; 8KB did not provide enough fallback reduction to justify extra read/decode work.","next_action_hint":"Keep 4KB retry; retry size appears bracketed by 2KB too small and 8KB too large."}}
{"run":54,"commit":"fd0a6ff","metric":7.912,"metrics":{"best_ms":6.725,"worst_ms":10.625,"session_count":480,"entries_per_session":19,"large_session_count":80,"long_initial_prompt_count":48,"total_session_bytes":13441680},"status":"discard","description":"Use a 3KB retry metadata head before full-file fallback","timestamp":1776802860424,"segment":2,"confidence":2.023591087811271,"iterationTokens":978,"asi":{"hypothesis":"A 3KB retry might be a lower-cost midpoint that still covers most long initial prompts handled by the current 4KB retry.","rollback_reason":"Median regressed versus 7.412ms; 3KB is still too small or not consistently better than 4KB on the robust corpus.","next_action_hint":"Keep 4KB retry."}}
{"run":55,"commit":"fd0a6ff","metric":8.375,"metrics":{"best_ms":7.022,"worst_ms":11.819,"session_count":480,"entries_per_session":19,"large_session_count":80,"long_initial_prompt_count":48,"total_session_bytes":13441680},"status":"discard","description":"Use a 768-byte fast metadata head before the 4KB retry","timestamp":1776802898209,"segment":2,"confidence":2.6574870912220323,"iterationTokens":936,"asi":{"hypothesis":"A larger first head may avoid the retry for more long prompts while staying cheaper than reading 4KB for every session.","rollback_reason":"Median regressed versus 7.412ms; increasing the first read size for all sessions costs more than the saved retries.","next_action_hint":"Keep the 512-byte first head plus 4KB retry."}}
