{"run":56,"commit":"fd0a6ff","metric":26.673,"metrics":{"best_ms":6.084,"worst_ms":33.113,"session_count":480,"entries_per_session":19,"large_session_count":80,"long_initial_prompt_count":48,"total_session_bytes":13441680},"status":"discard","description":"Reuse an open file descriptor for the 512-byte head and 4KB retry reads","timestamp":1776802973848,"segment":2,"confidence":1.8186101295641932,"iterationTokens":2042,"asi":{"hypothesis":"Avoiding a second open/close for retrying long initial prompts should reduce fallback overhead.","rollback_reason":"Median regressed catastrophically; keeping descriptors open until after retry caused high variance and much worse typical latency, likely due to delayed close or FD churn interactions.","next_action_hint":"Keep the separate readStoredSessionMetadataHead calls that close each descriptor promptly."}}
