{"type":"config","name":"Optimize web bridge initial session list load","metricName":"session_list_ms","metricUnit":"ms","bestDirection":"lower"}
{"run":1,"commit":"e522f67","metric":29.46,"metrics":{"best_ms":28.942,"worst_ms":34.817,"session_count":480,"entries_per_session":19},"status":"keep","description":"Baseline harness for initial list_sessions RPC over 480 stored sessions","timestamp":1776799982616,"segment":0,"confidence":null,"iterationTokens":96,"asi":{"hypothesis":"Measure current startup list_sessions cost with a synthetic multi-workspace corpus before changing behavior.","benchmark_shape":"8 workspaces x 60 sessions, 19 JSONL entries per session, median of 7 fresh adapter RPCs.","initial_bottleneck_guess":"list_sessions opens each JSONL through SessionManager.open and scans full entries for display metadata."}}
{"run":2,"commit":"252350a","metric":17.171,"metrics":{"best_ms":16.915,"worst_ms":20.765,"session_count":480,"entries_per_session":19},"status":"keep","description":"Read stored session list metadata without constructing SessionManager for every file","timestamp":1776800094990,"segment":0,"confidence":null,"iterationTokens":5232,"asi":{"hypothesis":"Avoiding SessionManager.open for stored list rows will remove duplicate JSONL reads, full entry arrays, and index construction while preserving response shape.","implementation_note":"readStoredSessionMetadata parses each JSONL once for header, first user text, and latest session_info; live and cached session managers still use existing path.","observed_result":"Median list_sessions RPC improved from 29.46ms to 17.171ms on 480 sessions."}}
{"run":3,"commit":"55f9f8e","metric":8.437,"metrics":{"best_ms":7.781,"worst_ms":11.595,"session_count":480,"entries_per_session":19},"status":"keep","description":"Stop scanning a session file after finding the first user display text","timestamp":1776800130683,"segment":0,"confidence":2.4070299977100986,"iterationTokens":1121,"asi":{"hypothesis":"Current display-name precedence returns the first user message before any explicit session_info name, so session files with a user message do not need a full scan.","implementation_note":"readStoredSessionMetadata now breaks as soon as it extracts first user text; sessions without user text still scan for latest session_info fallback.","observed_result":"Median dropped from 17.171ms to 8.437ms; benchmark corpus has an early first user entry, which matches common sessions."}}
{"run":4,"commit":"5aa6b40","metric":6.64,"metrics":{"best_ms":5.984,"worst_ms":9.129,"session_count":480,"entries_per_session":19},"status":"keep","description":"Parse stored session metadata line by line instead of splitting whole files","timestamp":1776800200499,"segment":0,"confidence":4.3338714272148895,"iterationTokens":3649,"asi":{"hypothesis":"Avoiding full split arrays for every JSONL reduces allocation and lets the early first-user break pay off on startup scans.","implementation_note":"readStoredSessionMetadata now walks newline offsets over the read string and skips reparsing the header in the metadata loop.","observed_result":"Median improved from 8.437ms to 6.64ms with checks passing."}}
{"run":5,"commit":"aa79961","metric":5.841,"metrics":{"best_ms":5.244,"worst_ms":7.684,"session_count":480,"entries_per_session":19},"status":"keep","description":"Precompute session-list recency sort keys during row construction","timestamp":1776800257582,"segment":0,"confidence":9.0982280431433,"iterationTokens":2516,"asi":{"hypothesis":"Sorting hundreds of sessions should not repeatedly Date.parse the same timestamps in comparator calls.","implementation_note":"Session list rows carry a private activitySortValue and strip it before returning the RPC payload.","observed_result":"Median improved from 6.64ms to 5.841ms, a smaller but consistent allocation and Date.parse reduction."}}
{"run":6,"commit":"aa79961","metric":5.864,"metrics":{"best_ms":4.914,"worst_ms":9.605,"session_count":480,"entries_per_session":19},"status":"discard","description":"Fast-path already canonical ISO timestamps in normalizeSessionTimestamp","timestamp":1776800295554,"segment":0,"confidence":14.008896797153033,"iterationTokens":1442,"asi":{"hypothesis":"Most Pi session headers are already canonical toISOString values, so skipping Date reconstruction might reduce row build cost.","rollback_reason":"Median did not improve versus 5.841ms current best; regex check cost offset any Date normalization savings in this workload.","next_action_hint":"If timestamp normalization remains hot, consider computing normalized timestamp and sort value together without regex, but focus elsewhere first."}}
{"run":7,"commit":"aa79961","metric":8.55,"metrics":{"best_ms":5.577,"worst_ms":12.582,"session_count":480,"entries_per_session":19},"status":"discard","description":"Use an array instead of Set while collecting stored session files","timestamp":1776800333660,"segment":0,"confidence":9.17955693742713,"iterationTokens":1207,"asi":{"hypothesis":"Avoid Set construction for stored session paths and rely on append-time dedupe.","rollback_reason":"Median regressed because live-session directory duplicates were parsed before append-time dedupe could skip them.","next_action_hint":"If retrying, check seenSessionPaths before readStoredSessionMetadata or keep the Set-based de-duplication."}}
{"run":8,"commit":"aa79961","metric":6.088,"metrics":{"best_ms":5.309,"worst_ms":9.09,"session_count":480,"entries_per_session":19},"status":"discard","description":"Skip duplicate stored session paths before metadata reads without building a Set","timestamp":1776800364096,"segment":0,"confidence":15.116160000000008,"iterationTokens":1165,"asi":{"hypothesis":"An array plus seenSessionPaths pre-read check might avoid Set construction while still skipping live-directory duplicates.","rollback_reason":"Median regressed versus 5.841ms; iterating duplicates and checking the growing seen set was slower than Set de-duplication up front.","next_action_hint":"Keep storedSessionFiles as a Set unless file collection strategy changes more substantially."}}
{"run":9,"commit":"aa79961","metric":6.023,"metrics":{"best_ms":5.025,"worst_ms":8.392,"session_count":480,"entries_per_session":19},"status":"discard","description":"Cache workspace metadata while building the session list","timestamp":1776800399549,"segment":0,"confidence":29.560700876095137,"iterationTokens":1164,"asi":{"hypothesis":"Many sessions share the same workspace, so caching workspace display metadata might avoid repeated path.basename work.","rollback_reason":"Median regressed; Map lookup and cache maintenance cost more than recomputing the small metadata object for this workload.","next_action_hint":"Do not add workspace metadata caching unless profiling shows path handling dominates on a much larger list."}}
{"run":10,"commit":"aa79961","metric":8.442,"metrics":{"best_ms":6.2,"worst_ms":11.538,"session_count":480,"entries_per_session":19},"status":"discard","description":"Read only the head of each session file before falling back to full metadata scans","timestamp":1776800480273,"segment":0,"confidence":15.926500337154424,"iterationTokens":3517,"asi":{"hypothesis":"Most display names come from the first user message near the top of the JSONL, so a bounded head read could avoid reading long transcripts.","rollback_reason":"Median regressed on the current startup corpus; manual open/read/close plus fallback logic outweighed savings for small and medium session files.","next_action_hint":"This may still help very large historical sessions. Revisit only with a benchmark corpus containing multi-MB JSONL files and reinitialize the workload metric."}}
{"run":11,"commit":"aa79961","metric":5.883,"metrics":{"best_ms":5.217,"worst_ms":7.854,"session_count":480,"entries_per_session":19},"status":"discard","description":"Avoid trimming JSONL lines before JSON.parse during metadata scans","timestamp":1776800536795,"segment":0,"confidence":29.560700876095137,"iterationTokens":2247,"asi":{"hypothesis":"JSON.parse accepts whitespace, so avoiding trim() on every scanned line may reduce allocation.","rollback_reason":"Median regressed slightly versus 5.841ms; the emptiness checks and raw CR handling did not beat trim() in practice.","next_action_hint":"Leave line trimming unchanged unless a profiler identifies it as hot under a different corpus."}}
{"run":12,"commit":"7ff0b6a","metric":5.762,"metrics":{"best_ms":5.303,"worst_ms":7.758,"session_count":480,"entries_per_session":19},"status":"keep","description":"Normalize session-list timestamps and sort keys with one Date.parse","timestamp":1776800587749,"segment":0,"confidence":42.129777777777775,"iterationTokens":1942,"asi":{"hypothesis":"Session rows currently parse each timestamp once for response normalization and again for sort keys; combining both should reduce row construction cost without changing output.","implementation_note":"Added normalizeSessionListTimestamp for list_sessions rows while leaving the general normalizeSessionTimestamp helper unchanged for other callers.","observed_result":"Median improved from 5.841ms to 5.762ms; small but primary metric improved and checks passed."}}
{"run":13,"commit":"7ff0b6a","metric":6.266,"metrics":{"best_ms":5.219,"worst_ms":9.549,"session_count":480,"entries_per_session":19},"status":"discard","description":"Bypass SessionRuntime live-path check for non-live session running state","timestamp":1776800639705,"segment":0,"confidence":55.760000000000026,"iterationTokens":1907,"asi":{"hypothesis":"list_sessions already branches on liveSessionFile, so non-live running checks can go directly to DetachedSessionRegistry and avoid repeated live-path lookups.","rollback_reason":"Median regressed versus 5.762ms; the runtime helper was not a meaningful bottleneck and direct registry access did not improve the workload.","next_action_hint":"Keep using SessionRuntime.isSessionRunning for clarity unless larger profiling shows running-state lookup costs dominate."}}
{"run":14,"commit":"7ff0b6a","metric":6.024,"metrics":{"best_ms":5.35,"worst_ms":7.951,"session_count":480,"entries_per_session":19},"status":"discard","description":"Skip live-session directory readdir when it is already under the stored sessions root","timestamp":1776800680636,"segment":0,"confidence":63.110519307589925,"iterationTokens":1581,"asi":{"hypothesis":"The stored session root scan already includes the live session directory in normal startup, so skipping the extra live-dir readdir could reduce duplicate path work.","rollback_reason":"Median regressed; path.relative checks and helper indirection cost more than the small duplicate directory scan in this workload.","next_action_hint":"Avoid path containment checks in the hot path unless the live-dir duplicate scan becomes much larger than one workspace directory."}}
{"run":15,"commit":"7ff0b6a","metric":6.123,"metrics":{"best_ms":5.521,"worst_ms":8.935,"session_count":480,"entries_per_session":19},"status":"discard","description":"Append session files into the root list without per-directory arrays","timestamp":1776800736121,"segment":0,"confidence":84.0354609929078,"iterationTokens":2394,"asi":{"hypothesis":"Avoiding filter/map arrays and spread while enumerating session files might reduce startup allocations.","rollback_reason":"Median regressed versus 5.762ms; the simpler filter/map implementation is faster under this directory shape.","next_action_hint":"Keep file enumeration as-is; the hot path is metadata parsing and sorting, not small per-directory arrays."}}
{"run":16,"commit":"7ff0b6a","metric":6.125,"metrics":{"best_ms":5.363,"worst_ms":9.267,"session_count":480,"entries_per_session":19},"status":"discard","description":"Return stored session metadata immediately when first user text is found","timestamp":1776800795521,"segment":0,"confidence":87.28545119705325,"iterationTokens":2334,"asi":{"hypothesis":"The common path finds first user text early, so returning immediately might avoid a variable assignment and post-loop nullish coalescing.","rollback_reason":"Median regressed versus 5.762ms; duplicate return-object construction did not improve the hot path.","next_action_hint":"Keep the single post-loop return shape for readability and performance."}}
{"run":17,"commit":"7ff0b6a","metric":6.08,"metrics":{"best_ms":5.308,"worst_ms":8.977,"session_count":480,"entries_per_session":19},"status":"discard","description":"Store session-list sort keys on a symbol to avoid stripping rows before response","timestamp":1776800844931,"segment":0,"confidence":91.49806949806938,"iterationTokens":1815,"asi":{"hypothesis":"Using a symbol sort key would be ignored by JSON serialization and could avoid the responseSessions map allocation.","rollback_reason":"Median regressed versus 5.762ms; symbol property access and hidden-class changes outweighed removing the map.","next_action_hint":"Keep explicit responseSessions mapping with a plain activitySortValue field."}}
{"run":18,"commit":"7ff0b6a","metric":6.111,"metrics":{"best_ms":5.252,"worst_ms":8.237,"session_count":480,"entries_per_session":19},"status":"discard","description":"Hoist the session-list row comparator out of the RPC handler","timestamp":1776800941364,"segment":0,"confidence":97.32238193018479,"iterationTokens":1815,"asi":{"hypothesis":"Avoid allocating a fresh sort comparator closure for every list_sessions RPC.","rollback_reason":"Median regressed versus 5.762ms; closure allocation is not material and the hoisted helper did not help V8 optimize this path.","next_action_hint":"Keep comparator inline unless restructuring sort behavior for another reason."}}
{"run":19,"commit":"7ff0b6a","metric":5.97,"metrics":{"best_ms":5.334,"worst_ms":8.719,"session_count":480,"entries_per_session":19},"status":"discard","description":"Fast-path the first JSONL line as the session header before blank-line fallback","timestamp":1776801004406,"segment":0,"confidence":103.93859649122818,"iterationTokens":1974,"asi":{"hypothesis":"Generated session files start with the session header, so parsing the first line directly might avoid the generic header scan loop.","rollback_reason":"Median regressed versus 5.762ms; extra candidate trim and fallback branch cost more than the tiny generic loop.","next_action_hint":"Do not specialize header scanning unless removing trim or fallback safely becomes possible."}}
{"run":20,"commit":"7ff0b6a","metric":5.93,"metrics":{"best_ms":5.177,"worst_ms":8.87,"session_count":480,"entries_per_session":19},"status":"discard","description":"Cache live session running state once per list_sessions call","timestamp":1776801039958,"segment":0,"confidence":122.78756476683934,"iterationTokens":1273,"asi":{"hypothesis":"Avoid calling ctx.isIdle() from inside row construction and make live running state a single per-RPC value.","rollback_reason":"Median regressed versus 5.762ms; live running state is evaluated at most once in this workload, so the extra variable did not help.","next_action_hint":"Do not micro-optimize live running state lookup without profiling a case where live duplicates are appended repeatedly."}}
{"run":21,"commit":"7ff0b6a","metric":6.32,"metrics":{"best_ms":5.414,"worst_ms":7.781,"session_count":480,"entries_per_session":19},"status":"discard","description":"Avoid trim in list-specific timestamp parsing","timestamp":1776801082661,"segment":0,"confidence":113.38755980861217,"iterationTokens":2862,"asi":{"hypothesis":"Stored session header timestamps are strings already, so Date.parse directly might avoid timestamp.trim() allocation in the list-specific normalizer.","rollback_reason":"Median regressed versus 5.762ms; the prior helper shape was faster despite trim.","next_action_hint":"Do not alter timestamp parsing shape without a broader timestamp-format reason."}}
{"run":22,"commit":"7ff0b6a","metric":5.841,"metrics":{"best_ms":5.478,"worst_ms":8.969,"session_count":480,"entries_per_session":19},"status":"discard","description":"Shortcut display-name whitespace collapse when text has only single spaces","timestamp":1776801148112,"segment":0,"confidence":108.45766590389009,"iterationTokens":2306,"asi":{"hypothesis":"First user messages often contain normal single spaces, so avoiding regex replacement in collapseWhitespace might reduce display-name extraction cost.","rollback_reason":"Median regressed versus 5.762ms; extra regex test and helper call did not beat the existing replace/trim path.","next_action_hint":"Leave collapseWhitespace unchanged unless a broader text-normalization refactor is needed."}}
{"run":23,"commit":"7ff0b6a","metric":6.171,"metrics":{"best_ms":5.21,"worst_ms":7.75,"session_count":480,"entries_per_session":19},"status":"discard","description":"Inline the string-content fast path for stored session display text","timestamp":1776801186444,"segment":0,"confidence":113.38755980861217,"iterationTokens":1108,"asi":{"hypothesis":"Most first user messages are plain string content, so avoiding the general extractMessageText helper call might reduce metadata extraction overhead.","rollback_reason":"Median regressed versus 5.762ms; the branch/inlining shape was slower than the existing helper call.","next_action_hint":"Keep using extractMessageText for consistency unless optimizing with profiler-guided changes."}}
{"type":"config","name":"Optimize web bridge initial session list load with mixed long transcripts","metricName":"session_list_ms","metricUnit":"ms","bestDirection":"lower"}
{"run":24,"commit":"e22151c","metric":13.092,"metrics":{"best_ms":11.415,"worst_ms":14.138,"session_count":480,"entries_per_session":19,"large_session_count":80,"total_session_bytes":13334064},"status":"keep","description":"Baseline mixed startup corpus with long historical session transcripts","timestamp":1776801279667,"segment":1,"confidence":null,"iterationTokens":105,"asi":{"hypothesis":"Broaden the workload to avoid overfitting to small JSONL files and capture the user's slow initial load when historical sessions are large.","benchmark_shape":"8 workspaces x 60 sessions, 80 long sessions, 13.3MB total JSONL, median of 7 fresh adapter RPCs.","baseline_note":"Current best code from small/medium corpus reads full session files, so long transcripts increase median to 13.092ms."}}
{"run":25,"commit":"7aa1d07","metric":9.651,"metrics":{"best_ms":7.934,"worst_ms":11.965,"session_count":480,"entries_per_session":19,"large_session_count":80,"total_session_bytes":13334064},"status":"keep","description":"Use bounded head reads for stored session metadata before falling back to full files","timestamp":1776801350680,"segment":1,"confidence":null,"iterationTokens":3679,"asi":{"hypothesis":"For long transcripts, list_sessions only needs the header and first user message, so reading a bounded file head should avoid loading megabytes of unused JSONL data while preserving fallback for sessions without early user text.","implementation_note":"readStoredSessionMetadata reads 32KB, parses only complete JSONL lines, returns if it found first user text or the file fit in the buffer, and falls back to full-file parsing otherwise.","observed_result":"Mixed long-transcript median improved from 13.092ms to 9.651ms while checks passed."}}
{"run":26,"commit":"8d31644","metric":8.11,"metrics":{"best_ms":6.517,"worst_ms":9.919,"session_count":480,"entries_per_session":19,"large_session_count":80,"total_session_bytes":13334064},"status":"keep","description":"Reduce the bounded metadata head read from 32KB to 8KB","timestamp":1776801380673,"segment":1,"confidence":3.232965606748864,"iterationTokens":972,"asi":{"hypothesis":"The needed header and first user entry are usually within the first few KB, so a smaller head buffer should reduce file I/O and string decoding for long sessions while still falling back safely.","implementation_note":"STORED_SESSION_METADATA_HEAD_BYTES changed from 32KB to 8KB; fallback remains unchanged if no complete early user metadata is found.","observed_result":"Mixed workload median improved from 9.651ms to 8.11ms."}}
{"run":27,"commit":"f215894","metric":6.67,"metrics":{"best_ms":5.758,"worst_ms":9.766,"session_count":480,"entries_per_session":19,"large_session_count":80,"total_session_bytes":13334064},"status":"keep","description":"Reduce the bounded metadata head read from 8KB to 4KB","timestamp":1776801410706,"segment":1,"confidence":4.308621268030863,"iterationTokens":971,"asi":{"hypothesis":"A 4KB head should still cover generated session headers and early first user messages, while reducing read and decode cost further than 8KB.","implementation_note":"STORED_SESSION_METADATA_HEAD_BYTES changed from 8KB to 4KB; full-file fallback still protects sessions whose first user text is later.","observed_result":"Mixed workload median improved from 8.11ms to 6.67ms."}}
{"run":28,"commit":"5b270da","metric":5.936,"metrics":{"best_ms":5.604,"worst_ms":9.589,"session_count":480,"entries_per_session":19,"large_session_count":80,"total_session_bytes":13334064},"status":"keep","description":"Reduce the bounded metadata head read from 4KB to 2KB","timestamp":1776801441167,"segment":1,"confidence":4.643737832576249,"iterationTokens":933,"asi":{"hypothesis":"Generated headers plus first user messages should usually fit within 2KB, further reducing per-session head read cost for large histories.","implementation_note":"STORED_SESSION_METADATA_HEAD_BYTES changed from 4KB to 2KB with unchanged full-file fallback.","observed_result":"Mixed workload median improved from 6.67ms to 5.936ms; close to the original small-file best despite 13.3MB corpus."}}
